{
  "id": "L1-workflow-basic",
  "title": "AxWorkflow type driven by an existing table",
  "tier": 1,
  "instruction": "Create an approval workflow type named ConFmVehicleNoteWorkflow driven by the FmVehicle table. Use `d365fo get table FmVehicle` first to confirm the table exists before generating. Use only the d365fo CLI (search/get/generate/validate) — do not hand-write XML.",
  "canonical_args": ["generate", "workflow", "ConFmVehicleNoteWorkflow", "--table", "FmVehicle"],
  "target_artifact_types": ["AxWorkflow"],
  "golden_path": "L1-workflow-basic",
  "tags": ["workflow", "metadata"],
  "ignore": [],
  "requires_fixture_index": true,
  "golden_pending": false
}
